<?xml version="1.0" encoding="UTF-8"?>
<simulation_parameters xmlns:xsi="http://www.w3.org/2001/XMLSchema-instance"
xsi:noNamespaceSchemaLocation="/Users/bullard/thames_wd/parameters.xsd">
<calctime>	0.001	</calctime>
<calctime>	0.004	</calctime>
<calctime>	0.007	</calctime>
<calctime>	0.01	</calctime>
<calctime>	0.013	</calctime>
<calctime>	0.016	</calctime>
<calctime>	0.019	</calctime>
<calctime>	0.022	</calctime>
<calctime>	0.025	</calctime>
<calctime>	0.028	</calctime>
<calctime>	0.031	</calctime>
<calctime>	0.034	</calctime>
<calctime>	0.037	</calctime>
<calctime>	0.04	</calctime>
<calctime>	0.043	</calctime>
<calctime>	0.046	</calctime>
<calctime>	0.049	</calctime>
<calctime>	0.052	</calctime>
<calctime>	0.055	</calctime>
<calctime>	0.058	</calctime>
<calctime>	0.061	</calctime>
<calctime>	0.064	</calctime>
<calctime>	0.067	</calctime>
<calctime>	0.07	</calctime>
<calctime>	0.073	</calctime>
<calctime>	0.076	</calctime>
<calctime>	0.079	</calctime>
<calctime>	0.082	</calctime>
<calctime>	0.085	</calctime>
<calctime>	0.088	</calctime>
<calctime>	0.091	</calctime>
<calctime>	0.094	</calctime>
<calctime>	0.097	</calctime>
<calctime>	0.1	</calctime>
<calctime>	0.103	</calctime>
<calctime>	0.106	</calctime>
<calctime>	0.109	</calctime>
<calctime>	0.112	</calctime>
<calctime>	0.115	</calctime>
<calctime>	0.118	</calctime>
<calctime>	0.121	</calctime>
<calctime>	0.124	</calctime>
<calctime>	0.127	</calctime>
<calctime>	0.13	</calctime>
<calctime>	0.133	</calctime>
<calctime>	0.136	</calctime>
<calctime>	0.139	</calctime>
<calctime>	0.142	</calctime>
<calctime>	0.145	</calctime>
<calctime>	0.148	</calctime>
<calctime>	0.151	</calctime>
  <image_frequency>1.0</image_frequency>
</simulation_parameters>
